{
  "smartlink_id": "spring_sale_2026",
  "timestamp": "2026-03-15T14:23:45.123Z",
  "ip": "185.43.120.88",
  "country": "DE",
  "language": "de",
  "device": "mobile",
  "user_agent": "Mozilla/5.0 (iPhone; CPU iPhone OS 17_0 like Mac OS X) AppleWebKit/605.1.15 (KHTML, like Gecko) Version/17.0 Mobile/15E148 Safari/604.1",
  "referrer": "https://www.tiktok.com/@example_brand/video/1234567890",
  "utm": {
    "source": "tiktok",
    "medium": "social",
    "campaign": "spring_2026_mobile_blitz",
    "content": "video_ad_v2"
  },
  "query_params": {
    "promo": "SPRING20",
    "lang": "de"
  },
  "edge_location": "FRA"
}
